payment_method,search_time,dealer,group,make,insurance_amount,baby_seat_price,luggage_rack_price,gps_price,price_with_reimbursement,fuel_policy,general_conditions_tarifa,general_conditions_reserva,general_conditions_cancelacion,politica_cancelacion,km_policy,pick_up_date_time,pick_up_location,return_date_time,return_location,dealer_conditions,driver_policy,license_policy,age_policy,franquicia,additional_driver,rental_cars_info,dealer_information,city,start_date,end_date
Pago online,29/11/2015,"Empresa:
    Europcar","Grupo:
    MCMR",Fiat Panda  o similar,"28,53€","7,99€",false,"9,99€","60,91€","Políticas de combustibleCombustible - OpcionesLe entregarán el tanque de combustible lleno o parcialmente lleno; y cuando devuelva el vehículo, deberá entregarlo con la misma cantidad de combustible que cuando se lo entregaron.
Si lo devuelve con menos combustible del acordado, la compañía de alquiler le cobrará la parte que falte. Este cargo dependerá del tamaño del vehículo y de la política sobre el combustible de la compañía local de alquiler.
Cuando retire el vehículo le pedirán que deje un depósito por el combustible, que normalmente se lo bloquearán en la tarjeta de crédito que utilice cuando firme el contrato de alquiler.
En algunas ocasiones la compañía de alquiler le permitirá o exigirá que pague por el combustible al retirar el vehículo.","La tarifa especial del proveedor incluye tasas, impuestos y seguro/s obligatorio/s.

		En el caso de que el cliente solicite algún servicio opcional en el momento de recogida del vehículo, el cliente deberá abonar su importe a la empresa de alquiler de vehículos.

		Los cambios de fecha pueden suponer cambios en la tarifa.","El alquiler mínimo es por 1 día.

		El alquiler del coche se reserva hasta la hora de recogida acordada.

		Facilitar información falsa puede provocar la anulación de la responsabilidad de la compañía y el cliente será considerado responsable de cualquier daño que pueda causar a si mismo, al coche, a la propiedad o a terceros.   

 		Es necesario presentar una tarjeta de crédito válida a nombre del conductor en el momento de la recogida como depósito por el coche (no se aceptan tarjetas de débito). Lee las normas y restricciones del coche   desglosadas con los detalles del depósito.

		Es posible que se apliquen restricciones geográficas, en lo relativo a circular por otro país distinto al de la recogida del vehículo, incluso en contratos de alquiler que incluyan kilometraje ilimitado. Algunas compañías de alquiler de coches no permiten atravesar determinadas fronteras domésticas o internacionales.

En algunas ocasiones y dependiendo de la compañía de alquiler, puede haber un cargo por localización (Location Service Charge) que será aplicado a todos los alquileres originados en las oficinas de aeropuerto, en algunas estaciones de ferrocarril y en ciertas oficinas de centros históricos.

Se puede dar que en algunos casos y dependiendo de la compañía de alquiler, si una oficina permanece cerrada dentro de su horario habitual y se realiza la recogida o devolución del vehículo, puede ocasionar un cargo extra que debe ser abonado directamente en la misma oficina de alquiler.

		Puedes ponerte en contacto con Atrapalo.com en el número 902 200 808 para cualquier aclaración adicional.","Las reservas se pueden cancelar, aunque es posible que la compañía se reserve el derecho a cobrar una penalización por cancelación. Consulte las condiciones a tal efecto establecidas por el proveedor más abajo.","Cancelaciones y No-ShowsCancelaciones: Reservas pagadas inicialmente en su totalidad

Si cancela 48 o más horas antes de la fecha de inicio del alquiler, le devolveremos la totalidad del importe pagado.
Si cancela 48 horas antes de la recogida, le devolveremos todo menos el coste de 3 días de alquiler.
Si la duración de su alquiler es inferior a 3 días, no le cobraremos un cargo adicional, pero tampoco efectuaremos una devolución.
Si no retira el vehículo en la fecha y hora acordada, y/o no pudo facilitar a la compañía de alquiler la documentación necesaria, y/o no tenía una tarjeta de crédito con un disponible suficiente, puede que no le entreguen el vehículo. De ser el caso:

Si nos llama desde la oficina local, le devolveremos lo que pagó menos 3 días de alquiler
Si no nos llama desde la oficina, no efectuaremos ninguna devolución.
Cancelaciones: Reservas pagadas inicialmente con un depósito

Si cancela 48 o más horas antes de la fecha de inicio del alquiler, le devolveremos todo lo que pagó menos el depósito que pago inicialmente.
Si cancela con menos de 48 horas de antelación, pero antes de que comience su alquiler, le devolveremos todo lo que pagó menos o bien el depósito o el coste de 3 días de alquiler, lo que sea mayor.
Si la duración de su alquiler es inferior a 3 días, no le cobraremos un cargo adicional, pero tampoco efectuaremos una devolución.
No-Show
Se considera ‘No-show’ cuando:

desea cancelar la reserva pero no nos informa antes de la fecha de inicio del alquiler, o
no retira el vehículo en la fecha y hora acordada, o
no puede proporcionar a la compañía de alquiler la documentación necesaria para poder retirar el vehículo, o
no dispone de una tarjeta de crédito a nombre del conductor principal con un disponible suficiente.

En todos estos casos, no le devolveremos nada del importe pagado.
La compañía de coches de alquiler se reserva el derecho de no entregar el vehículo a un cliente si no llega a tiempo, con toda la documentación necesaria y una tarjeta de crédito con fondos suficientes para dejar el depósito de seguridad. En tal caso, y a menos que el alquiler haya sido cancelado con anterioridad, el cliente no tendrá derecho a un reembolso.Cambiar una reserva
Puede modificar su reserva online, totalmente gratis, en cualquier momento y antes del inicio del alquiler. Si desea modificar algo que pueda afectar el precio del alquiler, como por ejemplo el lugar, tipo de vehículo o duración del alquiler location, le cobraremos según el precio publicado, y que puede ser diferente al que pagó inicialmente. 
Por favor, llámenos si tiene que recoger el coche en menos de 48 horas y desea modificar su reserva.
Importante: el precio se basa teniendo en cuenta la fecha y hora de recogida y devolución que determine en su reserva antes de retirar el vehículo. Si devuelve el vehículo antes o lo retira más tarde de la hora establecida, no le devolveremos la parte correspondiente por las horas no utilizadas.
Cancelaciones: Reservas pagadas inicialmente en su totalidad
Si cancela 48 o más horas antes del inicio del alquler, le devolveremos el total de su reserva.
Si cancela 48 horas antes de la hora de recogida, le devolveremos el total, menos el cargo de la compañía de alquiler:  50,00 € más el coste de 3 días de alquiler.
Si su alquiler es de menos de 3 días, no se le cobrará un extra adicional, pero tampoco recibirá ninguna devolución.
Si no llega a la hora y/o día acordada, y/o no puede presentar la documentación necesaria, y/o no dispone de una tarjeta de crédito con un disponible suficiente para dejar el depósito, la compañía de alquiler podría no entregarle el vehículo de alquiler. De ser el caso, la compañía de alquiler le cobraría un 100.00 % del coste del alquiler y por lo tanto no recibiría ninguna devolución.",Kilómetros / MillasKilometraje limitado y/o ilimitadoKilometraje ilimitado.,30-11-2015 a las 10:00:00,Formentera - Puerto de la Sabina (Formentera - Puerto de la Sabina),false,false,"Seguros, coberturas y exencionesCoberturas en caso de dañosLa Cobertura parcial por colisión (CDW) limita la responsabilidad del conductor si el vehículo es dañado, pero siempre sujeto a los términos y condiciones del contrato de alquiler.
En vez de pagar por la totalidad, el conductor únicamente se responsabilizará de una primera parte, conocida como ""Franquicia"" y/o ""Deducible"".
Esta cobertura se aplica para todos los conductores autorizados que aparezcan en el contrato de alquiler.La Responsabilidad civil a terceros (TPL) cubre la responsabilidad del conductor si daña la propiedad de un tercero, pero excluye la del propio vehículo de alquiler. También cubre las lesiones que otras personas sufran, sean o no en el vehículo de alquiler; pero siempre sujeto a los términos y condiciones del contrato de alquiler.Cobertura antirroboLa Cobertura antirrobo (TP) limita la responsabilidad del conductor si el vehículo es robado y/o dañado durante el robo o intento; a una parte denominada ""Franquicia"" y/o ""Deducible"", y siempre sujeto a los términos y condiciones del contrato de alquiler. 
Esta protección no cubre efectos personales, pero algunos seguros del hogar o de viaje los cubren.","Tasa de conductor jovenLos conductores con edades comprendidas entre los 21 y 24 años deberán pagar una tasa de conductor joven de  19,82 € al día, excluyendo las tasas, y un máximo de  192,00 €.","Licencia de conducirAl retirar el vehículo, el conductor principal y los conductores adicionales deberán presentar su licencia de conducir.Todos los conductores deberán tener una licencia con al menos 1 año(s) de antigüedad.Aquellos conductores con una licencia de conducir con foto y con una parte en papel deberán presentar ambas partes para retirar el vehículo.Los Permisos de conducir que hayan sido expedidos por la República Popular de China deberán estar acompañados por una traducción notarial, en lugar de un permiso de conducir internacional.No todos los proveedores aceptan las licencias de conducir chinas incluso junto con una traducción notarial.Los conductores con la nueva licencia de conducir del Reino Unido (""Photocard"") también deberán presentar la parte en papel.Los conductores con la licencia de papel del Reino Unido también deberán presentar un documento oficial con una fotografía.Los clientes deberán enviar por email una copia de las sanciones que tengan en su licencia de conducir a Rentalcars.com, o les podrían negar el alquiler al momento de retirar el vehículo.",Límites de edadLa edad mínima para conducir este vehículo es de 25 años.Todos los cargos y restricciones relacionados con la edad se aplican a todos los conductores adicionales.,"Depósitos, franquicias/deducibles y coberturasDepósito / FranquiciaDepósitos y franquicias/deduciblesDebido a las fluctuaciones de los tipos de cambio y otros posibles gastos bancarios, la compañía de alquiler no se hará responsable de las diferencias entre el importe pagado y el devuelto.La compañía de alquiler le pedirá que deje un depósito del coste estimado del alquiler, además de un 5.00 % adidional y el coste de un tanque de combustible, incluyendo las tasas. Le desbloquearán el depósito cuando devuelva el vehículo y en las condiciones acordadas.La compañía de alquiler le pedirá que deje un depósito al retirar el vehículo, y se basará en alguna de las siguientes condiciones:
 Tipo de vehículo
 Duración del alquiler
 Coste del combustible
 Años de conducción
Precio del alquiler
Y si contrata algún seguro adicional, o alquila algún extra localmente.Cobertura de Rentalcars.comCobertura por DañosCobertura de Daños 
Al contratar el producto de Cobertura por Daños de Rentalcars.com antes de retirar el vehículo, limitaremos su responsabilidad (y le devolveremos) por: 
los cargos por daños al exterior del vehículo o componentes mecánicos, incluyendo:
carrocería, techos y bajos
parabrisas, cristales y espejos
ruedas, llantas, tapacubos
motor, embrague o batería
cerraduras

La Cobertura de Daños de Rentalcars.com  no  le exime de responsabilidad con referencia a:
los “cargos por inmovilización” (mientras el vehículo está siendo reparado y no puede ser alquilado)
los cargos por la asistencia en carretera en caso de accidente o avería
los gastos directamente relacionados si pierde las llaves o cierra el vehículo y se quedan dentro
la cantidad que la compañía de alquiler le cobre como resultado de la reclamación de la póliza de la Protección Antirrobo
los cargos administrativos que tengan lugar como resultado de cualquiera de los puntos antes mencionados.
las reparaciones  no autorizadas  por la compañía de alquiler.
los gastos por la limpieza del vehículo o daños en el interior del mismo (a menos que sea causado por una colisión)
el daño o pérdida de la sillita de niño, GPS o cualquier otro extra alquilado localmente.

Todos los conductores deben cumplir con los términos del contrato de alquiler: nuestro producto de Cobertura de Daños no le reembolsará los gastos incurridos en circunstancias que violen términos como conducción temeraria, imprudente o negligente, errores de repostaje de combustible, o conducir bajo la influencia de drogas o alcohol. 
Si contrata nuestro producto de Cobertura de Daños, la compañía de alquiler le seguirá bloqueando en su tarjeta de crédito el depósito de seguridad en caso de que el vehículo sea dañado o desaparezca. Con nuestra Cobertura de Daños limitaremos su responsabilidad de pagar por los gastos de los daños que le hemos detallado y le devolveremos el depósito retenido para cubrir estos cargos, siempre sujeto a los términos que aquí se describen.Cobertura totalCobertura Total 
Al contratar el producto de Cobertura Total de Rentalcars.com antes de retirar el vehículo, limitaremos su responsabilidad (y le devolveremos) por: 
los cargos por daños al exterior del vehículo o componentes mecánicos, incluyendo:

carrocería, techos y bajos
parabrisas, cristales y espejos
ruedas, llantas, tapacubos
motor, embrague o batería
cerraduras

los “cargos por inmovilización” (mientras el vehículo está siendo reparado y no puede ser alquilado)
los cargos por la asistencia en carretera en caso de accidente o avería
los gastos directamente relacionados si pierde las llaves o cierra el vehículo y se quedan dentro
la cantidad que la compañía de alquiler le cobre como resultado de la reclamación de la póliza de la Protección Antirrobo
los cargos administrativos que tengan lugar como resultado de cualquiera de los puntos antes mencionados.
La Cobertura de Total de Rentalcars.com no le exime de responsabilidad con referencia a:
las reparaciones no autorizadas por la compañía de alquiler.
los gastos por la limpieza del vehículo o daños en el interior del mismo (a menos que sea causado por una colisión)
el daño o pérdida de la sillita de niño, GPS o cualquier otro extra alquilado localmente.

Todos los conductores deben cumplir con los términos del contrato de alquiler: nuestro producto de Cobertura Total no le reembolsará los gastos incurridos en circunstancias que violen términos como conducción temeraria, imprudente o negligente, errores de repostaje de combustible, o conducir bajo la influencia de drogas o alcohol. 
Si contrata nuestro producto de Cobertura Total, la compañía de alquiler le seguirá bloqueando en su tarjeta de crédito el depósito de seguridad en caso de que el vehículo sea dañado o desaparezca. Con nuestra Cobertura Total limitaremos su responsabilidad de pagar por los gastos de los daños que le hemos detallado y le devolveremos el depósito retenido para cubrir estos cargos, siempre sujeto a los términos que aquí se describen.
Beneficios de la proteciónSi contrata cualquiera de los productos de Rentalcars.com para proteger la franquicia durante el alquiler, se beneficiará de las ventajas de nuestro producto; pero si no hace una reclamación formal no podremos efectuar una devolución.Coberturas y seguros aceptados localmenteCobertura personalEl Seguro de accidente personal (PAI) cubre los gastos médicos y legales incurridos por lesiones corporales resultantes en un accidente, incluyendo la muerte y/o la pérdida de extremidades, y siempre sujeto a los términos del contrato de alquiler.
Esta cobertura se aplica para todos los conductores autorizados que aparezcan en el contrato del vehículo de alquiler.Cobertura adicionalLa Super cobertura parcial por colisión (SCDW) reduce la responsabilidad del conductor en caso de que el vehículo sea dañado. Limita la obligación legal del conductor a pagar por las reparaciones o sustitución del vehículo, pero siempre sujeto a los términos del contrato de alquiler. 
En vez de pagar por la totalidad se responsabilizará únicamente de una primera parte, conocida como ""Franquicia"" y/o ""Deducible"", que en muchos casos está establecida a Cero, y por ello queda exento de responsabilidad. 
Esta cobertura se aplica para todos los conductores autorizados que aparezcan en el contrato del vehículo de alquiler.Tipo de coberturaTipo de coberturaEn la oficina de alquiler, le darán la opción de contratar una cobertura adicional para reducir o eliminar la franquicia y/o deducible, o para cubrir las partes que la Cobertura parcial por colisión (CDW) no cubra, tales como neumáticos y parabrisas.
Tenga en cuenta que si decide contratar esta Cobertura el nuevo acuerdo será entre usted y la compañía de alquiler. Como Rentalcars.com no formaría parte de ese contrato, no podríamos ayudarle si queda insatisfecho con el precio o la cobertura.Por favor, asegúrese de leer los términos y condiciones que incluye la cobertura de su contrato de alquiler al retirar el vehículo, y compruebe cuales son los límites y exclusiones.
Muchas coberturas normalmente excluyen parabrisas, cristales, llantas, neumáticos, bajos, interior del vehículo, objetos personales, cargos por remolque y el tiempo que el vehículo no pueda estar en circulación; y cualquier extra que alquile localmente, como asientos para niños y GPS dispositivos.
Tenga en cuenta que su cobertura no cubre los daños causados al vehículo en circunstancias tales como negligencia, un error en el repostaje o el incumplimiento de los términos del contrato de alquiler (por ejemplo, si conduce bajo la influencia del alcohol o drogas).Tasas administrativasCargo administrativoLa compañía de alquiler le cobrará por los daños ocasionados al vehículo cuando lo devuelva, además de un Cargo administrativo por los daños.Si daña el vehículo deberá pagar un Cargo de inmovilización obligatoriamente, además de la cantidad que le retengan de su franquicia y/o deducible. Este cargo se calcula teniendo en cuenta el grupo del vehículo y el número de días que no pueda ser alquilado debido a estar reparándose.Si el vehículo queda involucrado en un accidente (individual o a terceros) o es robado, deberá pagar una tasa administrativa de aproximadamente  50,75 € además de la franquicia / deducible que no es  reembolsable.","Otros conductoresEl precio por añadir un conductor adicional es de  8,89 € al día. El precio máximo por alquiler es de  63,54 € excluyendo las tasas.Los cargos de la compañía de alquiler relacionados con la edad se aplican a todos los conductores.","Reserva - AcuerdoAntes de retirar el vehículo le recomendamos que lea detenidamente los Términos y Condiciones de su alquiler, para asegurarse que comprende las normas y leyes del lugar donde va a conducir.Asegúrese de informarse de los documentos que deberá llevar (por ejemplo, licencia de conducir, documento nacional de identidad y tarjetas de pago) y lo que necesita para pagar en el la oficina local. Si no dispone de todos los requisitos que la compañía de alquiler le solicita puede que no le entreguen el vehículo.Al confirmar esta reserva, usted confirmó que había leido y aceptado nuestros Términos y Condiciones. Al retirar el vehículo, la compañía de alquiler le pedirá que firme el contrato de alquiler. Por favor, asegúrese de leerlo cuidadosamente y si no entiende alguna claúsula consulte a la compañía de alquiler antes de partir. Si no está satisfecho con alguno de los aspectos de su alquiler, es muy importante que se lo haga saber al proveedor al momento. Y si aún no está de acuerdo póngase en contacto con nosotros en la sección ""Contactar""Si tiene alguna consulta no dude en ponerse en contacto con nosotros. En nuestra página web y en la sección de ""Contactar"" aparece toda la información de contacto.Si durante su alquiler tiene algún problema, llame al teléfono de Emergencia que aparece en su vale de confirmación.Información relativa a los tipos de cambio y tasas Tenga en cuenta que Rentalcars.com no se hace responsable de las fluctuaciones en los tipos de cambio o cualquier cargo que su banco o emisor de tarjeta de crédito le cobre. Por eso la cantidad que aparezca en el extracto de su tarjeta de crédito puede diferir de la cantidad que vio cuando realizó su reserva. Igualmente, le devolveremos el importe exacto que le cobramos inicialmente si tenemos que hacerle una devolución.Puede ver nuestros Términos y Condiciones en: http://www.rentalcars.com/TermsAndConditions.do","Normas de la compañíaAccidente o avería - En caso de avería, accidente o dificultades técnicas, deberá llamar a la compañía de alquiler local de inmediato. Ellos tienen que darle la autorización en caso de que necesite hacer alguna reparación o para entregarle un vehículo de sustitución. Por favor, guarde las copias de toda la documentación que tenga que rellenar; puede que sea necesarío si tiene que hacer una reclamación. En caso de accidentes, un informe policial y de incidentes de la compañía de alquiler será requisito indispensable.Asistencia en carreteras - La mayoría de las empresas de alquiler disponen de algún tipo de servicio para la asistencia en carretera en caso de emergencia, por el que posiblemene tenga que pagar un extra. Al retirar el vehículo, asegúrese de averiguar dónde se encuentra toda la documentación, normalmente está en la guantera o en el parasol del vehículo.Pérdida de llaves - Si pierde la(s) llave(s), le cobrarán un cargo por su sustitución.Cinturón de seguridad - Donde quiera que conduzca, tanto el conductor como los pasajeros deberán llevar los cinturones de seguridad abrochados.Tenga en cuenta que no se puede fumar en ningún vehículo de alquiler. Si no cumple con esta norma le podrían multar.Cálculo del precio - Los precios del alquiler se basan en la hora de recogida y devolución del vehículo; y que usted confirmó cuando reservó. Si retira el vehículo más tarde o lo devuelve antes, no le devolverán la parte correspondiente por el tiempo que no utilice el vehículo.Si al retirar el vehículo prefiere otro diferente al contratado inicialmente, le podrían cobrar una cantidad adicional o premium; incluso si el vehículo es de menor tamaño al reservado.Si el vehículo queda involucrado en un accidente y vuelca quedando el techo en el suelo, puede que le pidan que pague un cargo adicional además de la franquicia.",Formentera,2015-11-30,2015-12-02
